{
  "schema_version": "openttd-rl-v1-dependency-lock-1",
  "schema_sha256": "ca03ea5c8b44f4c6c0cb739b581e7fd58d985907c8ee282e3fc9405a55913279",
  "profile_id": "ubuntu-24.04-wsl2-x86_64-cuda13",
  "host": {
    "architecture": "x86_64",
    "python": "3.12",
    "cxx": "GCC 13.3.0",
    "cmake": "3.28.3",
    "ninja": "1.11.1",
    "cuda": "13.0.88",
    "gpu_cc": "12.0"
  },
  "policy": {
    "offline_after_acquisition": true,
    "reject_unlisted_archives": true,
    "publish_external_binaries": false
  },
  "artifacts": [
    {
      "id": "libtorch-cu130",
      "component": "LibTorch shared-with-deps CUDA",
      "version": "2.13.0+cu130",
      "kind": "zip",
      "relative_cache_path": "libtorch-shared-with-deps-2.13.0+cu130.zip",
      "url": "https://download.pytorch.org/libtorch/cu130/libtorch-shared-with-deps-2.13.0%2Bcu130.zip",
      "size_bytes": 500687821,
      "sha256": "945c5a3d946a28b387ad9dc9fddda7ba03e35fae1375b84ebff15df789436f82",
      "license_expression": "BSD-3-Clause with bundled third-party notices",
      "license_evidence": "locked pytorch-license and pytorch-notice artifacts from v2.13.0",
      "publication_disposition": "not-published; reacquire from pinned upstream URL"
    },
    {
      "id": "pytorch-license",
      "component": "PyTorch license evidence",
      "version": "2.13.0",
      "kind": "text",
      "relative_cache_path": "licenses/pytorch-2.13.0-LICENSE",
      "url": "https://raw.githubusercontent.com/pytorch/pytorch/v2.13.0/LICENSE",
      "size_bytes": 3464,
      "sha256": "bd018feef8825e88181c84eb7e3aa4eafb8f08a20d9fd6ef948569610c4a3e43",
      "license_expression": "BSD-3-Clause",
      "license_evidence": "this locked upstream v2.13.0 LICENSE file",
      "publication_disposition": "not-published; reacquire from pinned upstream URL"
    },
    {
      "id": "pytorch-notice",
      "component": "PyTorch third-party notice evidence",
      "version": "2.13.0",
      "kind": "text",
      "relative_cache_path": "licenses/pytorch-2.13.0-NOTICE",
      "url": "https://raw.githubusercontent.com/pytorch/pytorch/v2.13.0/NOTICE",
      "size_bytes": 23632,
      "sha256": "c2cc7bf0caec7652c2b460a8a470bea1677f241e4ab8e431df34cf17f5a9fec0",
      "license_expression": "third-party notices; see locked text",
      "license_evidence": "this locked upstream v2.13.0 NOTICE file",
      "publication_disposition": "not-published; reacquire from pinned upstream URL"
    },
    {
      "id": "onnxruntime-cpu",
      "component": "ONNX Runtime Linux x64 CPU",
      "version": "1.28.0",
      "kind": "tgz",
      "relative_cache_path": "onnxruntime-linux-x64-1.28.0.tgz",
      "url": "https://github.com/microsoft/onnxruntime/releases/download/v1.28.0/onnxruntime-linux-x64-1.28.0.tgz",
      "size_bytes": 9125960,
      "sha256": "a3e1b79d7bb1bf09696ce675f49e4064e6c81f6202b8225624fff0e93f8d6407",
      "license_expression": "MIT with bundled third-party notices",
      "license_evidence": "LICENSE and ThirdPartyNotices.txt in archive",
      "publication_disposition": "not-published; reacquire from pinned upstream URL"
    },
    {
      "id": "nvidia-cudnn-cu13",
      "component": "NVIDIA cuDNN CUDA 13 runtime",
      "version": "9.20.0.48",
      "kind": "wheel",
      "relative_cache_path": "nvidia_cudnn_cu13-9.20.0.48-py3-none-manylinux_2_27_x86_64.whl",
      "url": "https://files.pythonhosted.org/packages/6e/5e/edb9c0ae051602c3ccaffe424256463636d639e27d7f302dde9975ef9e7a/nvidia_cudnn_cu13-9.20.0.48-py3-none-manylinux_2_27_x86_64.whl",
      "size_bytes": 366173588,
      "sha256": "0c45dd8eeb50b603f07995b1b300c62ffe6a1980482b82b3bcf94a4ca9d49304",
      "license_expression": "LicenseRef-NVIDIA-Proprietary",
      "license_evidence": "wheel METADATA License-Expression and LICENSE.txt",
      "publication_disposition": "not-published; reacquire from pinned upstream URL"
    },
    {
      "id": "nvidia-cusparselt-cu13",
      "component": "NVIDIA cuSPARSELt CUDA 13 runtime",
      "version": "0.8.1",
      "kind": "wheel",
      "relative_cache_path": "nvidia_cusparselt_cu13-0.8.1-py3-none-manylinux2014_x86_64.whl",
      "url": "https://files.pythonhosted.org/packages/34/7d/2661f2fb3ac4302f3a246f5fc030213ac60c1fe0bce84f9783dbd831dbb7/nvidia_cusparselt_cu13-0.8.1-py3-none-manylinux2014_x86_64.whl",
      "size_bytes": 170148586,
      "sha256": "786ce87568c303fadb5afcc7102d454cd3040d75f6f8626f5db460d1871f4dd0",
      "license_expression": "LicenseRef-NVIDIA-Proprietary",
      "license_evidence": "wheel METADATA License and License.txt",
      "publication_disposition": "not-published; reacquire from pinned upstream URL"
    },
    {
      "id": "nvidia-nccl-cu13",
      "component": "NVIDIA NCCL CUDA 13 runtime",
      "version": "2.29.7",
      "kind": "wheel",
      "relative_cache_path": "nvidia_nccl_cu13-2.29.7-py3-none-manylinux_2_18_x86_64.whl",
      "url": "https://files.pythonhosted.org/packages/67/f4/58e4e91b6919367c7aafb8e36fce9aad1a3047e536bf7e2fd560927d3a4c/nvidia_nccl_cu13-2.29.7-py3-none-manylinux_2_18_x86_64.whl",
      "size_bytes": 205976000,
      "sha256": "edd81538446786ec3b73972543e53bb43bcaf0bfc8ef76cb679fcc390ffe136d",
      "license_expression": "LicenseRef-NVIDIA-Proprietary",
      "license_evidence": "wheel METADATA License-Expression and LICENSE.txt",
      "publication_disposition": "not-published; reacquire from pinned upstream URL"
    },
    {
      "id": "nvidia-nvshmem-cu13",
      "component": "NVIDIA NVSHMEM CUDA 13 runtime",
      "version": "3.4.5",
      "kind": "wheel",
      "relative_cache_path": "nvidia_nvshmem_cu13-3.4.5-py3-none-manylinux2014_x86_64.manylinux_2_17_x86_64.whl",
      "url": "https://files.pythonhosted.org/packages/3c/35/a9bf80a609e74e3b000fef598933235c908fcefcef9026042b8e6dfde2a9/nvidia_nvshmem_cu13-3.4.5-py3-none-manylinux2014_x86_64.manylinux_2_17_x86_64.whl",
      "size_bytes": 60412546,
      "sha256": "290f0a2ee94c9f3687a02502f3b9299a9f9fe826e6d0287ee18482e78d495b80",
      "license_expression": "LicenseRef-NVIDIA-Proprietary",
      "license_evidence": "wheel METADATA License-Expression and LICENSE.txt",
      "publication_disposition": "not-published; reacquire from pinned upstream URL"
    },
    {
      "id": "exporter-filelock",
      "component": "filelock",
      "version": "3.32.2",
      "kind": "wheel",
      "relative_cache_path": "python-exporter-wheels/filelock-3.32.2-py3-none-any.whl",
      "url": "https://files.pythonhosted.org/packages/c1/e8/72f8cef9fdfeffe06213fe8508039396ee48daa0e3259457ed766173bfd6/filelock-3.32.2-py3-none-any.whl",
      "size_bytes": 98830,
      "sha256": "87dd94cf281e586d135fa51132b8e3d9a598b316e90377a288663c9321036c82",
      "license_expression": "MIT",
      "license_evidence": "wheel METADATA License-Expression",
      "publication_disposition": "not-published; reacquire from pinned upstream URL"
    },
    {
      "id": "exporter-fsspec",
      "component": "fsspec",
      "version": "2026.7.0",
      "kind": "wheel",
      "relative_cache_path": "python-exporter-wheels/fsspec-2026.7.0-py3-none-any.whl",
      "url": "https://files.pythonhosted.org/packages/fd/3c/6a2bf344106328fd04963664a60b9bb6496fc25df8e962fcdc1367285fb9/fsspec-2026.7.0-py3-none-any.whl",
      "size_bytes": 206583,
      "sha256": "b57ddbafedfaef7018c1ecab32aa200a9d7ca26b77965f64e48b70061249d279",
      "license_expression": "BSD-3-Clause",
      "license_evidence": "wheel METADATA License-Expression",
      "publication_disposition": "not-published; reacquire from pinned upstream URL"
    },
    {
      "id": "exporter-jinja2",
      "component": "Jinja2",
      "version": "3.1.6",
      "kind": "wheel",
      "relative_cache_path": "python-exporter-wheels/jinja2-3.1.6-py3-none-any.whl",
      "url": "https://files.pythonhosted.org/packages/62/a1/3d680cbfd5f4b8f15abc1d571870c5fc3e594bb582bc3b64ea099db13e56/jinja2-3.1.6-py3-none-any.whl",
      "size_bytes": 134899,
      "sha256": "85ece4451f492d0c13c5dd7c13a64681a86afae63a5f347908daf103ce6d2f67",
      "license_expression": "BSD-3-Clause",
      "license_evidence": "wheel dist-info LICENSE.txt",
      "publication_disposition": "not-published; reacquire from pinned upstream URL"
    },
    {
      "id": "exporter-markupsafe",
      "component": "MarkupSafe",
      "version": "3.0.3",
      "kind": "wheel",
      "relative_cache_path": "python-exporter-wheels/markupsafe-3.0.3-cp312-cp312-manylinux2014_x86_64.manylinux_2_17_x86_64.manylinux_2_28_x86_64.whl",
      "url": "https://files.pythonhosted.org/packages/3c/2e/8d0c2ab90a8c1d9a24f0399058ab8519a3279d1bd4289511d74e909f060e/markupsafe-3.0.3-cp312-cp312-manylinux2014_x86_64.manylinux_2_17_x86_64.manylinux_2_28_x86_64.whl",
      "size_bytes": 22947,
      "sha256": "d6dd0be5b5b189d31db7cda48b91d7e0a9795f31430b7f271219ab30f1d3ac9d",
      "license_expression": "BSD-3-Clause",
      "license_evidence": "wheel METADATA License-Expression",
      "publication_disposition": "not-published; reacquire from pinned upstream URL"
    },
    {
      "id": "exporter-ml-dtypes",
      "component": "ml_dtypes",
      "version": "0.5.4",
      "kind": "wheel",
      "relative_cache_path": "python-exporter-wheels/ml_dtypes-0.5.4-cp312-cp312-manylinux_2_27_x86_64.manylinux_2_28_x86_64.whl",
      "url": "https://files.pythonhosted.org/packages/3a/cb/28ce52eb94390dda42599c98ea0204d74799e4d8047a0eb559b6fd648056/ml_dtypes-0.5.4-cp312-cp312-manylinux_2_27_x86_64.manylinux_2_28_x86_64.whl",
      "size_bytes": 5009002,
      "sha256": "9ad459e99793fa6e13bd5b7e6792c8f9190b4e5a1b45c63aba14a4d0a7f1d5ff",
      "license_expression": "Apache-2.0",
      "license_evidence": "wheel METADATA License-Expression",
      "publication_disposition": "not-published; reacquire from pinned upstream URL"
    },
    {
      "id": "exporter-mpmath",
      "component": "mpmath",
      "version": "1.3.0",
      "kind": "wheel",
      "relative_cache_path": "python-exporter-wheels/mpmath-1.3.0-py3-none-any.whl",